{
  "$schema": "https://json-schema.org/draft/2020-12/schema",
  "title": "Research external artifact metadata (separate from AI Builder contract)",
  "type": "object",
  "additionalProperties": false,
  "required": ["id", "uri", "version", "sha256", "access", "description", "rights"],
  "properties": {
    "id": {"type": "string", "minLength": 1},
    "uri": {"type": "string", "format": "uri"},
    "version": {"type": "string", "minLength": 1},
    "sha256": {"type": "string", "pattern": "^[a-f0-9]{64}$"},
    "access": {"type": "string", "minLength": 1},
    "description": {"type": "string", "minLength": 1},
    "rights": {"type": "string", "minLength": 1}
  }
}
