{
  "id": "mr09-llama-b11669-cudart",
  "uri": "https://github.com/ggml-org/llama.cpp/releases/download/b11669/cudart-llama-bin-win-cuda-13.4-x64.zip",
  "version": "b11669; source620d2225cc436ab0b001e3200e590e3b286ef9ab",
  "sha256": "738f8c251ac22b70c3ae6f83a10cf222725df0395246a2cf58f32bdb85fbe668",
  "access": "Official public pinned archive accessed 2026-10-18; locally verified in task-owned temporary storage, removed after qualification.",
  "description": "Pinned official CUDA support archive, locally hash/size verified. Archive label, DLL file metadata and API-reported versions are recorded separately without assuming full CUDA feature compatibility.",
  "rights": "NVIDIA CUDA redistributable/library terms are separate from llama.cpp MIT licensing. Distribution rights are not established here; libraries remain external and task copies are removed."
}
