{
  "id": "t4-mcp-1300-wheel",
  "uri": "https://files.pythonhosted.org/packages/f5/f4/e58bc33317c92a0203664daaf00bf6f41166cc0149e5d6870a03f7cd004a/mcp-1.30.0-py3-none-any.whl",
  "version": "1.30.0",
  "sha256": "666edb5009503e1047c9d60346a756f94b261f05cc2625f23d41c728ffc484d0",
  "access": "Public exact PyPI wheel accessed and downloaded 2026-10-18. SHA-256 and byte size matched the versioned PyPI JSON metadata; local package installed only in an isolated temporary experiment environment.",
  "description": "Official mcp 1.30.0 wheel used for the bounded synthetic local stdio protocol observation. Package identity is distinct from vendor-server compatibility.",
  "rights": "Publisher package metadata identifies MIT. Wheel and third-party source are not redistributed in Git; source anchors and small synthetic-peer observation are retained."
}
